{
  "$schema": "https://json-schema.org/draft/2020-12/schema",
  "$id": "https://tymehall.org/schemas/work.v0.schema.json",
  "title": "Bounded Work Record v0",
  "type": "object",
  "additionalProperties": false,
  "required": ["work_id","created_at","lineage","intent","consequence","constraints","evidence_contract","lifecycle","activation"],
  "properties": {
    "work_id":{"type":"string","minLength":1},
    "created_at":{"type":"string","pattern":"^\\d{4}-\\d{2}-\\d{2}T\\d{2}:\\d{2}:[0-5]\\d(?:\\.\\d{1,6})?Z$"},
    "lineage": {
      "type":"object","additionalProperties":false,
      "required":["source_event_ref","admission_ref","review_disposition_ref","review_disposition_sha256","promotion_ref","promotion_sha256"],
      "properties": {
        "source_event_ref":{"type":"string","minLength":1},
        "admission_ref":{"type":"string","minLength":1},
        "review_disposition_ref":{"type":"string","minLength":1},
        "review_disposition_sha256":{"type":"string","pattern":"^[0-9a-f]{64}$"},
        "promotion_ref":{"type":"string","minLength":1},
        "promotion_sha256":{"type":"string","pattern":"^[0-9a-f]{64}$"}
      }
    },
    "intent": {
      "type":"object","additionalProperties":false,
      "required":["objective","scope","prohibited_scope"],
      "properties": {
        "objective":{"type":"string","minLength":1},
        "scope":{"type":"array","minItems":1,"items":{"type":"string","minLength":1}},
        "prohibited_scope":{"type":"array","items":{"type":"string","minLength":1}}
      }
    },
    "consequence": {
      "type":"object","additionalProperties":false,
      "required":["candidate_effect_classes","execution_authority","participant_binding"],
      "properties": {
        "candidate_effect_classes": {
          "type":"array","uniqueItems":true,
          "items":{"enum":["analysis_only","artifact_write","repository_branch_create","repository_file_mutation","pull_request_create","workflow_dispatch","external_publish","memory_write","canon_proposal"]}
        },
        "execution_authority":{"const":"none_until_participant_activation"},
        "participant_binding":{"const":null}
      }
    },
    "constraints": {
      "type":"object","additionalProperties":false,
      "required":["required_refs","fail_closed_on_missing"],
      "properties": {
        "required_refs":{"type":"array","minItems":1,"uniqueItems":true,"items":{"type":"string","minLength":1}},
        "fail_closed_on_missing":{"const":true}
      }
    },
    "evidence_contract": {
      "type":"object","additionalProperties":false,
      "required":["required_evidence","verification_target","trace_required","return_receiver"],
      "properties": {
        "required_evidence":{"type":"array","minItems":1,"uniqueItems":true,"items":{"type":"string","minLength":1}},
        "verification_target":{"type":"string","minLength":1},
        "trace_required":{"const":true},
        "return_receiver":{"type":"string","minLength":1}
      }
    },
    "lifecycle": {
      "type":"object","additionalProperties":false,
      "required":["state","terminal_condition","expires_at","supersedes_work_ref"],
      "properties": {
        "state":{"const":"PROMOTED_UNBOUND"},
        "terminal_condition":{"type":"string","minLength":1},
        "expires_at":{"type":["string","null"]},
        "supersedes_work_ref":{"type":["string","null"]}
      }
    },
    "activation": {
      "type":"object","additionalProperties":false,
      "required":["activation_required","activation_ref"],
      "properties": {
        "activation_required":{"const":true},
        "activation_ref":{"const":null}
      }
    }
  }
}
