{
  "work_id": "work-review-hb-02-frontier-containment",
  "created_at": "2026-08-23T10:34:00.000000Z",
  "lineage": {
    "source_event_ref": "signal:sig-frontier-containment-20260822-001",
    "admission_ref": "institutional-admissions/pending/adm-sig-frontier-containment-20260822-001.json",
    "review_disposition_ref": "institutional-reviews/decisions/review-hb-02-frontier-containment.json",
    "review_disposition_sha256": "e03169b5ea403e0ee3b95554bc8971254a24a4a6a5f4ebef0894043c2dab8cb2",
    "promotion_ref": "institutional-work/promotions/promotion-review-hb-02-frontier-containment.json",
    "promotion_sha256": "63a01a87482d081f633c5128009d10208c7005943fd229c1ae8e8c87a0d6f19e"
  },
  "intent": {
    "objective": "Observe and compare meaningful public developments in frontier AI containment and return evidence-bearing signals for institutional review.",
    "scope": [
      "read_approved_public_sources",
      "compare_against_prior_verified_state",
      "emit_candidate_signal_packet"
    ],
    "prohibited_scope": [
      "repository_mutation",
      "canon_mutation",
      "external_communication",
      "cyber_execution",
      "participant_self_expansion"
    ]
  },
  "consequence": {
    "candidate_effect_classes": [
      "analysis_only"
    ],
    "execution_authority": "none_until_participant_activation",
    "participant_binding": null
  },
  "constraints": {
    "required_refs": [
      "docs/architecture/WORK_MATURITY_V0.md",
      "schemas/signal_return.v0.1.schema.json",
      "schemas/admission.v0.schema.json",
      "schemas/review-disposition.v0.schema.json",
      "schemas/work-promotion.v0.schema.json",
      "schemas/work.v0.schema.json"
    ],
    "fail_closed_on_missing": true
  },
  "evidence_contract": {
    "required_evidence": [
      "source_signal_packet",
      "public_source_references",
      "comparison_result",
      "archivist_return",
      "trace_verification"
    ],
    "verification_target": "AVOT-TRACE",
    "trace_required": true,
    "return_receiver": "FIRST_HEARTBEAT_PILOT"
  },
  "lifecycle": {
    "state": "PROMOTED_UNBOUND",
    "terminal_condition": "Return one verified Frontier Containment signal cycle to the Continuum/CIT or close as no-semantic-change.",
    "expires_at": null,
    "supersedes_work_ref": null
  },
  "activation": {
    "activation_required": true,
    "activation_ref": null
  }
}
